{
  "id": "constraint-pack.ai-ui-no-design-system",
  "type": "constraint_pack",
  "version": "1.0.0",
  "title": "Portable no-design-system implementation authority",
  "summary": "A JudgmentKit-native implementation authority for UI generation when no external design system is present, with concrete primitives, React+Tailwind recipes, accessibility rules, state coverage, and handoff requirements.",
  "status": "active",
  "workflows": ["workflow.ai-ui-generation"],
  "guardrail_ids": [
    "guardrail.design-system-integrity",
    "guardrail.spec-completeness",
    "guardrail.control-proximity",
    "guardrail.surface-theme-parity"
  ],
  "guideline_profile_ids": [
    "guideline-profile.ai-ui-generation-authority",
    "guideline-profile.ai-ui-review-checks"
  ],
  "authority": {
    "when_to_use": "Use this pack when the repo, prompt, and brief do not provide an authoritative external design system or when the task explicitly asks for a portable JudgmentKit-native UI authority.",
    "priority_rules": [
      "If a referenced external design system exists and has a confirmed accessibility baseline or owner-approved review status, that system takes precedence.",
      "If no external design system exists, this pack becomes the source of truth for primitives, tokens, layout archetypes, required states, light-dark theme parity, reusable recipes, and handoff depth.",
      "If the pack, vendored guideline profiles, and brief are all silent about a requirement, escalate instead of inventing a new primitive, vague token, or unsupported interaction."
    ],
    "output_contract_sections": [
      "core_screens",
      "token_spec",
      "component_recipes",
      "screen_composition",
      "state_coverage",
      "theme_contract",
      "accessibility_contract",
      "escalation_items"
    ]
  },
  "implementation_model": {
    "target_stack": "react-tailwind",
    "recipe_format": "React+Tailwind snippets with explicit slots, variants, interaction rules, and accessibility API",
    "preview_artifacts": [
      "implementation-contract.json",
      "preview-source.tsx",
      "preview.html"
    ]
  },
  "primitives": {
    "inventory": [
      {
        "id": "layout-shell",
        "label": "Layout shell",
        "description": "Top-level application frame with optional rail, header, workspace body, and secondary inspector region.",
        "usage": "Required for app workspace, dashboard, review, and export surfaces.",
        "component_recipe": {
          "slots": ["rail", "header", "main", "inspector"],
          "variants": ["with-rail", "with-inspector", "centered-main"],
          "interaction_rules": [
            "Keep the primary task in main and secondary metadata in inspector.",
            "Do not move local controls away from the surface they govern."
          ],
          "accessibility_contract": [
            "Use main, nav, header, and aside landmarks where applicable.",
            "Preserve heading order and skip-link destination."
          ],
          "react_tailwind": "<div className=\"grid min-h-screen grid-cols-[240px_minmax(0,1fr)_320px] gap-4 bg-[var(--jk-color-canvas)] text-[var(--jk-color-text-primary)]\">...</div>"
        }
      },
      {
        "id": "sidebar-rail",
        "label": "Sidebar or rail",
        "description": "Persistent navigation or collection switcher aligned to the main workspace frame.",
        "usage": "Use for global navigation, queue switching, or mode changes.",
        "component_recipe": {
          "slots": ["label", "items", "footer"],
          "variants": ["nav", "history", "queue"],
          "interaction_rules": [
            "Active item must be visually distinct and keyboard reachable.",
            "Keep mode changes and run history grouped, not interleaved."
          ],
          "accessibility_contract": [
            "Use nav with an accessible label.",
            "Use links for navigation and buttons for actions."
          ],
          "react_tailwind": "<nav aria-label=\"Workspace navigation\" className=\"flex flex-col gap-2 rounded-[var(--jk-radius-2)] border border-[var(--jk-color-border-subtle)] bg-[var(--jk-color-surface)] p-4\">...</nav>"
        }
      },
      {
        "id": "header",
        "label": "Header",
        "description": "Surface-level title, status, and primary actions anchored to the region they govern.",
        "usage": "Use for page title, collection metadata, and scoped actions.",
        "component_recipe": {
          "slots": ["title", "meta", "actions"],
          "variants": ["workspace", "panel", "dialog"],
          "interaction_rules": [
            "Primary action stays in the same header as the governed surface.",
            "Keep status and secondary metadata subordinate to the title."
          ],
          "accessibility_contract": [
            "Use heading tags in hierarchy order.",
            "If actions change nearby content, keep them adjacent in DOM order."
          ],
          "react_tailwind": "<header className=\"flex items-start justify-between gap-4 border-b border-[var(--jk-color-border-subtle)] px-5 py-4\">...</header>"
        }
      },
      {
        "id": "card",
        "label": "Card",
        "description": "Contained surface block with a single content responsibility and explicit header-content-footer structure when needed.",
        "usage": "Use for summaries, settings groups, metrics, and review blocks.",
        "component_recipe": {
          "slots": ["header", "body", "footer"],
          "variants": ["summary", "settings", "review", "muted"],
          "interaction_rules": [
            "Use cards to group meaning, not to add decorative nesting.",
            "Promote content hierarchy before adding elevation."
          ],
          "accessibility_contract": [
            "Keep heading and body text associated in reading order.",
            "If footer actions exist, ensure they remain within the same card."
          ],
          "react_tailwind": "<section className=\"rounded-[var(--jk-radius-2)] border border-[var(--jk-color-border-subtle)] bg-[var(--jk-color-surface)] shadow-[var(--jk-elevation-1)]\">...</section>"
        }
      },
      {
        "id": "field",
        "label": "Field",
        "description": "Label, control, helper text, and validation message grouped as one primitive.",
        "usage": "Use for text input, toggles, selects, and textarea entry.",
        "component_recipe": {
          "slots": ["label", "control", "helper", "error"],
          "variants": ["text", "textarea", "select", "toggle"],
          "interaction_rules": [
            "Do not rely on placeholder text as the only label.",
            "Validation copy must stay next to the affected control."
          ],
          "accessibility_contract": [
            "Use label or aria-label on every control.",
            "Use aria-describedby for helper and error text when present."
          ],
          "react_tailwind": "<label className=\"grid gap-2 text-sm\"><span className=\"font-medium\">Label</span><textarea className=\"min-h-40 rounded-[var(--jk-radius-2)] border border-[var(--jk-color-border-subtle)] bg-[var(--jk-color-surface-muted)] px-3 py-3\" /></label>"
        }
      },
      {
        "id": "button",
        "label": "Button",
        "description": "Primary, secondary, or ghost action with explicit hierarchy and nearby scope.",
        "usage": "Use for create, save, continue, approve, and dismiss actions.",
        "component_recipe": {
          "slots": ["icon", "label"],
          "variants": ["primary", "secondary", "ghost", "danger"],
          "interaction_rules": [
            "Specific labels beat generic labels.",
            "Destructive actions require confirmation or undo language."
          ],
          "accessibility_contract": [
            "Icon-only buttons need aria-label.",
            "Focus-visible state must remain visible."
          ],
          "react_tailwind": "<button className=\"inline-flex min-h-10 items-center justify-center rounded-[var(--jk-radius-2)] px-4 font-medium focus-visible:outline-none focus-visible:ring-2 focus-visible:ring-[var(--jk-color-accent)]\">Generate First Pass</button>"
        }
      },
      {
        "id": "tabs",
        "label": "Tabs",
        "description": "Mutually exclusive view switcher for peer content regions.",
        "usage": "Use for switching between results, details, code, or history views.",
        "component_recipe": {
          "slots": ["list", "trigger", "panel"],
          "variants": ["underline", "segmented"],
          "interaction_rules": [
            "Tabs are for peer views, not unrelated navigation.",
            "Keep the active trigger visually obvious without decorative chrome."
          ],
          "accessibility_contract": [
            "Use tablist, tab, and tabpanel semantics.",
            "Support arrow-key navigation and active-state announcement."
          ],
          "react_tailwind": "<div><div role=\"tablist\" className=\"inline-flex gap-1 rounded-[var(--jk-radius-2)] bg-[var(--jk-color-surface-muted)] p-1\">...</div><div role=\"tabpanel\" className=\"mt-4\">...</div></div>"
        }
      },
      {
        "id": "table-list",
        "label": "Table or list",
        "description": "Structured repeated item presentation with sortable columns or grouped rows.",
        "usage": "Use for queues, records, events, or artifact history.",
        "component_recipe": {
          "slots": ["header", "rows", "empty-state"],
          "variants": ["table", "stacked-list", "checklist"],
          "interaction_rules": [
            "Use table semantics only when column relationships matter.",
            "Long content needs wrap or truncation rules."
          ],
          "accessibility_contract": [
            "Use table headers for true tabular relationships.",
            "Lists and checklist rows should expose names and states clearly."